{
  "database": {
    "database_name": "INDICI_BI_Full",
    "edition": "Developer Edition (64-bit)",
    "engine_edition": "3",
    "product_version": "15.0.4460.4",
    "version_string": "Microsoft SQL Server 2019 (RTM-CU32-GDR) (KB5077469) - 15.0.4460.4 (X64) \n\tFeb 13 2026 17:00:40 \n\tCopyright (C) 2019 Microsoft Corporation\n\tDeveloper Edition (64-bit) on Windows Server 2019 Standard 10.0 <X64> (Build 17763: )\n"
  },
  "generated_at": "2026-07-16T09:59:07.119639+00:00",
  "reconciliation": {
    "entries": [
      {
        "export_name": "dbo.Disease",
        "matched_object": "dbo.Disease",
        "status": "found_as_view"
      },
      {
        "export_name": "dbo.Patient",
        "matched_object": "dbo.Patient",
        "status": "found_as_view"
      },
      {
        "export_name": "fqb.invoices",
        "matched_object": "fqb.Invoices",
        "status": "found_as_view"
      },
      {
        "export_name": "dbo.Appointments",
        "matched_object": "dbo.Appointments",
        "status": "found_as_view"
      }
    ],
    "export_object_count": 4,
    "extra_objects": [
      "AIFinanceAssistant.VU_PracticeTotalExpenses",
      "AIFinanceAssistant.tblAIDashboards",
      "AIFinanceAssistant.tblAIWidgetTypes",
      "AIFinanceAssistant.tblAIWidgets",
      "AIFinanceAssistant.tblFinanceQueryBuilderHistory",
      "AIFinanceAssistant.tblMCPClaudeBindings",
      "AIFinanceAssistant.tblMCPClaudeConfiguration",
      "AIFinanceAssistant.tblPracticeExpense",
      "AIFinanceAssistant.tblSalary",
      "ARB.AppointmentMaternity",
      "ARB.CarePlan",
      "ARB.CarePlanDiagnosis",
      "ARB.HTIReferral",
      "ARB.ImmunisationNIRInline",
      "ARB.NextOfKin",
      "ARB.ProfileLanguage",
      "ARB.ReCallContact",
      "ARB.ReferralGroup",
      "ARB.ReferralGroupPatient",
      "ARB.ReferralGroupSession",
      "ARB.ReferralPatient",
      "ARB.ReferralPatientOutCome",
      "Admin.tblGeneralPractice",
      "Admin.tblGeneralPracticeProviders",
      "Admin.tblGeneralPracticeSpeciality",
      "Admin.tblLocationPractice",
      "Admin.tblPracticeLocation",
      "Admin.tblPracticeLocationAddress",
      "Admin.tblProviderLocation",
      "Appointment.tblACC18",
      "Appointment.tblACC45Definition",
      "Appointment.tblACC45Detail",
      "Appointment.tblACC45XML",
      "Appointment.tblAcc45Diagnosis",
      "Appointment.tblAcc45Referral",
      "Appointment.tblAcc45ReferralDetail",
      "Appointment.tblAllergies",
      "Appointment.tblAppointment",
      "Appointment.tblAppointmentCancelReason",
      "Appointment.tblAppointmentDetail",
      "Appointment.tblAppointmentHandOver",
      "Appointment.tblAppointmentImmunisation",
      "Appointment.tblAppointmentMaternity",
      "Appointment.tblAppointmentReason",
      "Appointment.tblAppointmentSlots",
      "Appointment.tblAppointmentSocialHistory",
      "Appointment.tblAppointmentStatus",
      "Appointment.tblAppointmentStatusLog",
      "Appointment.tblAppointmentTask",
      "Appointment.tblAppointmentTimer",
      "Appointment.tblAppointmentUserPreferences",
      "Appointment.tblCPToDoList",
      "Appointment.tblCarePlan",
      "Appointment.tblCarePlanAppointment",
      "Appointment.tblCarePlanDiagnosis",
      "Appointment.tblCarePlanGoal",
      "Appointment.tblCarePlanGoalActivity",
      "Appointment.tblCarePlanMember",
      "Appointment.tblCarePlanOutCome",
      "Appointment.tblCarePlanStatusHistory",
      "Appointment.tblClaim",
      "Appointment.tblCommonAppointmentProvider",
      "Appointment.tblDiagnosis",
      "Appointment.tblDiagnosisAttributes",
      "Appointment.tblDiagnosticReport",
      "Appointment.tblDiagnosticReportNotifications",
      "Appointment.tblDiagnosticReportResults",
      "Appointment.tblDiagnosticReportResultsExtensions",
      "Appointment.tblDischarge",
      "Appointment.tblExamination",
      "Appointment.tblExaminationDetail",
      "Appointment.tblFamilyDiseases",
      "Appointment.tblFamilyHistory",
      "Appointment.tblHTIOutComeRecorded",
      "Appointment.tblHTIReferral",
      "Appointment.tblHTIReferralAudit",
      "Appointment.tblHTIReferralInboxFolerItem",
      "Appointment.tblHealthLinkSession",
      "Appointment.tblImmunisationNIRInline",
      "Appointment.tblLabOrderDetail",
      "Appointment.tblLabOrderDiagnosis",
      "Appointment.tblLabOrderGroup",
      "Appointment.tblLabOrderReCall",
      "Appointment.tblLabOrderRecipients",
      "Appointment.tblLabOrderTask",
      "Appointment.tblLabOrders",
      "Appointment.tblLabTestOBRDiagnosis",
      "Appointment.tblLabTest_MSH",
      "Appointment.tblLabTest_NTE",
      "Appointment.tblLabTest_OBR",
      "Appointment.tblLabTest_OBX",
      "Appointment.tblLaborderLabMapping",
      "Appointment.tblLetterDocument",
      "Appointment.tblMYDNAPatientDiagnosticGenoType",
      "Appointment.tblMYDNAPatientDiagnosticMedication",
      "Appointment.tblMYDNAPatientNZULMDiagnosticMedication",
      "Appointment.tblMedicationDiagnosis",
      "Appointment.tblMedicationRecall",
      "Appointment.tblMedicationStandingOrder",
      "Appointment.tblMedications",
      "Appointment.tblNIRAcknowledgement",
      "Appointment.tblNIRCommunication",
      "Appointment.tblNIRCommunicationLog",
      "Appointment.tblNIRImmunisation_MSH",
      "Appointment.tblNIRImmunisation_NTE",
      "Appointment.tblNIRImmunisation_RXR",
      "Appointment.tblNIRImmunisation_VXX",
      "Appointment.tblObservation",
      "Appointment.tblOtherPracticeConsultLog",
      "Appointment.tblParkedDocuments",
      "Appointment.tblPatientDiagnosisTemplate",
      "Appointment.tblPatientDiagnosisTemplateDetail",
      "Appointment.tblPatientImmunisationSchedule",
      "Appointment.tblPatientResourceHistory",
      "Appointment.tblPatientSARecord",
      "Appointment.tblPatientSARecordDetail",
      "Appointment.tblPatientTemplateDetail",
      "Appointment.tblPrescriptionPrint",
      "Appointment.tblPrescriptionPrintDetail",
      "Appointment.tblPrescriptionPrintTask",
      "Appointment.tblQuickConsult",
      "Appointment.tblQuickConsult_History",
      "Appointment.tblReasonForContactSubService",
      "Appointment.tblReasonforVisit",
      "Appointment.tblReasonforVisitSelfAssessment",
      "Appointment.tblReasonforVisitSelfAssessmentDetail",
      "Appointment.tblReasonforVisitTemplateDetail",
      "Appointment.tblReasonforVisitresources",
      "Appointment.tblReferralDiagnosis",
      "Appointment.tblReferralGroup",
      "Appointment.tblReferralGroupPatient",
      "Appointment.tblReferralGroupSession",
      "Appointment.tblReferralOutComeDetail",
      "Appointment.tblReferralPatient",
      "Appointment.tblReferralPatientAppointment",
      "Appointment.tblReferralPatientDetail",
      "Appointment.tblReferralPatientProviderAsignmentLog",
      "Appointment.tblReferralPatientStatusLog",
      "Appointment.tblReferralScanDocuemntMapping",
      "Appointment.tblRxLog",
      "Appointment.tblScreening",
      "Appointment.tblScreeningData",
      "Appointment.tblScreeningDetail",
      "Appointment.tblScreeningDiagnosis",
      "Appointment.tblScreeningRecall",
      "Appointment.tblSpecimenForReport",
      "Appointment.tblSurgicalHistory",
      "Appointment.tblTimeLine",
      "Appointment.tblTriageTemplate",
      "Appointment.tblVideoConsultActivity",
      "Azure.tblFilterConfig",
      "BCP.BPIHistoryExtract",
      "BCP.CLASSIFICATION",
      "BCP.Drug",
      "BCP.EthnicityExtract",
      "BCP.INBOX",
      "BCP.INVLINE",
      "BCP.ImmunizationExtract",
      "BCP.InlineExtract",
      "BCP.MEASUREMENT",
      "BCP.MEDICALWARNING",
      "BCP.PROVIDER",
      "BCP.PatientsBPI",
      "BCP.ProvRole",
      "BCP.ReadV2Extract",
      "BCP.SCNOUTCOME",
      "BCP.SCRIPT",
      "BCP.SERVICEExtract",
      "BCP.SERVSUBS",
      "BCP.Screening",
      "BCP.TRANS",
      "BCP.tblHBLVaccMap",
      "BCP.tblNIRINLINE",
      "BI.AgeGroup",
      "BI.AlertType",
      "BI.Appointment",
      "BI.AppointmentOutCome",
      "BI.AppointmentReasonforVisit",
      "BI.AppointmentSlots",
      "BI.AppointmentStatus",
      "BI.AppointmentType",
      "BI.BookingSource",
      "BI.CityArea",
      "BI.ConsultationExtract",
      "BI.ConsultationExtract_APPTSVC",
      "BI.ConsultationExtract_APPTSVC_BK_20180125",
      "BI.ConsultationExtract_BK_20170907",
      "BI.ConsultationExtract_Invoice",
      "BI.Country",
      "BI.Diagnosis",
      "BI.DiagnosisType",
      "BI.DischargedPatient",
      "BI.Disease",
      "BI.EmailMetaDataExtract",
      "BI.EmailMetaDataExtract_BK_20180228",
      "BI.Ethnicity",
      "BI.Patient",
      "BI.PatientPortalEmail",
      "BI.PatientPrompts",
      "BI.Practice",
      "BI.Provider",
      "BI.ReadCodeToSnomedMappingExtract",
      "BI.ReasonforVisit",
      "BI.ScheduleSlots",
      "BI.SnomedToReadCodeMappingExtract",
      "BI.SuburbTown",
      "BI.Task",
      "BI.TaskStatus",
      "BI.TaskType",
      "BPI.tblACRData",
      "BPI.tblCVRA05YData",
      "BPI.tblCVRAAspirinData",
      "BPI.tblCVRABPData",
      "BPI.tblCVRAStatinData",
      "BPI.tblCX03YData",
      "BPI.tblDARData",
      "BPI.tblFlu65Data",
      "BPI.tblFlu65DiabetesData",
      "BPI.tblFluCOPDData",
      "BPI.tblHbA1c64Data",
      "BPI.tblImmunisation24Data",
      "BPI.tblImmunisation8Data",
      "BPI.tblMammogramData",
      "BPI.tblPatientCodingData",
      "BPI.tblPractice",
      "BPI.tblPracticeReport",
      "BPI.tblQuarter",
      "BPI.tblReport",
      "BPI.tblReportConfig",
      "BPI.tblSmokingBriefAdviceData",
      "BPI.tblSmokingStatusCodedData",
      "BPI.tblSummary",
      "BPI.tblTarget",
      "BPI.tblTestPatient",
      "BPI.tblYear",
      "Billing.tblAttribute",
      "Billing.tblCarePlanDiagnosis",
      "Billing.tblCaseOutcome",
      "Billing.tblConcept",
      "Billing.tblContractService",
      "Billing.tblContractServiceCoding",
      "Billing.tblDeclineReason",